{
  "$schema": "https://json-schema.org/draft/2020-12/schema",
  "$id": "https://plan-executor/schemas/tasks.schema.json",
  "title": "plan-executor compiled-plan manifest",
  "description": "Structured output of the plan-executor:compile-plan skill. Read and dispatched deterministically by the Rust scheduler. One LLM call produces this; no LLM invocation should mutate it after compile time.",
  "type": "object",
  "required": ["version", "plan", "waves", "tasks"],
  "additionalProperties": false,
  "properties": {
    "version": {
      "description": "Schema version. Bump on breaking changes.",
      "const": 1
    },
    "plan": {
      "type": "object",
      "required": ["goal", "type", "path", "status", "flags"],
      "additionalProperties": false,
      "properties": {
        "goal": { "type": "string", "minLength": 1 },
        "type": {
          "description": "Plan type drives default review/validation sets.",
          "enum": ["feature", "bug", "refactor", "chore", "docs", "infra"]
        },
        "jira": {
          "description": "JIRA ticket ID (e.g. CCP-123). Empty string if none.",
          "type": "string",
          "pattern": "^([A-Z][A-Z0-9]+-[0-9]+|)$"
        },
        "target_repo": {
          "description": "GitHub owner/repo slug where changes will be committed. Null for local-only runs.",
          "type": ["string", "null"],
          "pattern": "^[A-Za-z0-9._-]+/[A-Za-z0-9._-]+$"
        },
        "target_branch": {
          "description": "Feature branch to create/checkout for this plan.",
          "type": ["string", "null"]
        },
        "path": {
          "description": "Absolute path to the source plan markdown file. Embedded so the orchestrator can reference the plan without external lookups.",
          "type": "string",
          "minLength": 1
        },
        "status": {
          "description": "Execution state of the plan. Lives in the manifest, not in the plan markdown.",
          "enum": ["READY", "EXECUTING", "COMPLETED", "FAILED"],
          "default": "READY"
        },
        "flags": {
          "type": "object",
          "required": [
            "merge",
            "merge_admin",
            "skip_pr",
            "skip_code_review",
            "no_worktree",
            "draft_pr"
          ],
          "additionalProperties": false,
          "properties": {
            "merge": { "type": "boolean" },
            "merge_admin": { "type": "boolean" },
            "skip_pr": { "type": "boolean" },
            "skip_code_review": { "type": "boolean" },
            "no_worktree": { "type": "boolean" },
            "draft_pr": { "type": "boolean" }
          }
        }
      }
    },
    "waves": {
      "description": "Ordered list of execution waves. Each wave runs its task_ids in parallel. A wave starts when every wave in its depends_on array has completed successfully.",
      "type": "array",
      "minItems": 1,
      "items": {
        "type": "object",
        "required": ["id", "task_ids", "depends_on"],
        "additionalProperties": false,
        "properties": {
          "id": {
            "type": "integer",
            "minimum": 1,
            "description": "Unique wave ID. Fix-loop waves use IDs >= 100."
          },
          "task_ids": {
            "type": "array",
            "minItems": 1,
            "items": { "type": "string", "minLength": 1 }
          },
          "depends_on": {
            "type": "array",
            "items": { "type": "integer", "minimum": 1 },
            "uniqueItems": true
          },
          "kind": {
            "description": "Wave classification. `implementation` is the default.",
            "enum": ["implementation", "fix", "validation_fix"],
            "default": "implementation"
          }
        }
      }
    },
    "tasks": {
      "description": "Map from task_id -> task spec. Every task_id referenced in waves[].task_ids MUST exist here.",
      "type": "object",
      "minProperties": 1,
      "additionalProperties": {
        "type": "object",
        "required": ["prompt_file", "agent_type"],
        "additionalProperties": false,
        "properties": {
          "prompt_file": {
            "description": "Relative path (from tasks.json's directory) to the sub-task prompt markdown.",
            "type": "string",
            "pattern": "^tasks/[A-Za-z0-9._/-]+\\.(md|sh)$"
          },
          "agent_type": {
            "description": "Dispatcher picks the CLI based on this value. Enum is locked to what handoff.rs::AgentType supports.",
            "enum": ["claude", "codex", "gemini", "bash"]
          },
          "can_fail": {
            "description": "If true, a non-zero exit from this sub-agent is logged but does not fail the wave. Used for reviewer-diversity tasks (codex/gemini) where the tool may be unavailable.",
            "type": "boolean",
            "default": false
          },
          "description": {
            "description": "One-line human summary. Not read by the executor; for the compile-then-inspect step.",
            "type": "string"
          }
        }
      }
    }
  }
}
